{
  "$schema": "https://femboypuppy.github.io/Tessera/plugins/registry.schema.json",
  "version": 1,
  "name": "Tessera example plugins",
  "updatedAt": "2026-09-24",
  "plugins": [
    {
      "id": "word-count",
      "name": "Word count",
      "author": "Tessera",
      "description": "Words, characters and reading time of the page you are on, with an optional word goal.",
      "repo": "https://github.com/femboypuppy/Tessera/tree/main/examples/plugins/word-count",
      "version": "1.0.0",
      "apiVersion": 1,
      "download": "https://femboypuppy.github.io/Tessera/plugins/word-count-1.0.0.zip",
      "permissions": ["pages:read", "ui:panels"],
      "icon": "🔢",
      "tags": ["writing", "stats"]
    },
    {
      "id": "daily-notes",
      "name": "Daily notes",
      "author": "Tessera",
      "description": "One note per day, from a template, in a folder page. Open today’s note with a shortcut, or have it created when Tessera opens.",
      "repo": "https://github.com/femboypuppy/Tessera/tree/main/examples/plugins/daily-notes",
      "version": "1.0.0",
      "apiVersion": 1,
      "download": "https://femboypuppy.github.io/Tessera/plugins/daily-notes-1.0.0.zip",
      "permissions": ["pages:read", "pages:write", "ui:commands"],
      "icon": "📅",
      "tags": ["journal", "productivity"]
    },
    {
      "id": "pomodoro",
      "name": "Pomodoro",
      "author": "Tessera",
      "description": "A focus timer in a side panel: 25 minutes of work, short breaks, a long break every four sessions.",
      "repo": "https://github.com/femboypuppy/Tessera/tree/main/examples/plugins/pomodoro",
      "version": "1.0.0",
      "apiVersion": 1,
      "download": "https://femboypuppy.github.io/Tessera/plugins/pomodoro-1.0.0.zip",
      "permissions": ["ui:panels", "ui:commands", "storage"],
      "icon": "🍅",
      "tags": ["focus", "productivity"]
    },
    {
      "id": "random-page",
      "name": "Random page",
      "author": "Tessera",
      "description": "Opens a random page, for rediscovering old notes.",
      "repo": "https://github.com/femboypuppy/Tessera/tree/main/examples/plugins/random-page",
      "version": "1.0.0",
      "apiVersion": 1,
      "download": "https://femboypuppy.github.io/Tessera/plugins/random-page-1.0.0.zip",
      "permissions": ["pages:read", "ui:commands"],
      "icon": "🎲",
      "tags": ["discovery"]
    },
    {
      "id": "mermaid",
      "name": "Mermaid diagrams",
      "author": "Tessera",
      "description": "Flowcharts, sequence diagrams, timelines, mind maps and more, written as text and drawn in your theme.",
      "repo": "https://github.com/femboypuppy/Tessera/tree/main/examples/plugins/mermaid",
      "version": "1.0.0",
      "apiVersion": 1,
      "download": "https://femboypuppy.github.io/Tessera/plugins/mermaid-1.0.0.zip",
      "permissions": ["ui:blocks"],
      "icon": "🧜",
      "tags": ["diagrams", "blocks"]
    }
  ]
}
